{"aihoots":{"audit_verify":{"available":true,"command":"python3.14 -m src.verifier.cli /Users/prashantsingh/Desktop/memtara-zkp/cro_demo/aihoots_audit.jsonl","exit_code":0,"intact":true,"stderr":"","stdout":"OK: audit chain intact (/Users/prashantsingh/Desktop/memtara-zkp/cro_demo/aihoots_audit.jsonl)"},"matched":[],"path":"/Users/prashantsingh/Desktop/memtara-zkp/cro_demo/aihoots_audit.jsonl","proof_hashes_with_no_entry":["b5ae5f9f84aa60aa39b002a254c14d2545455b3440afdbb5809cdbdb1db8594c"],"records_malformed":0,"records_total":1,"supplied":true},"audit_chain_excerpt":[{"created_at":"2026-08-19T20:32:27.161863Z","event_hash":"41bf40d14df809f2364244c33759de1fbaf71e96bff93e2d8670c59d2fc8dfd6","event_type":"wealth_suitability_requested","prev_hash":"76a65065858ef993b254b6e58e48124f08f7da2aa967e4f677a277ccb33d4ceb","seq":4749},{"created_at":"2026-08-19T20:32:27.161863Z","event_hash":"fe4f6a22bfed13359ea12a0c5eb3a2951d4632bf064b26c4e4e0181985dedc21","event_type":"decision_model_attestation_bound","prev_hash":"41bf40d14df809f2364244c33759de1fbaf71e96bff93e2d8670c59d2fc8dfd6","seq":4750},{"created_at":"2026-08-19T20:32:27.161863Z","event_hash":"ea08398ebe27863eaf5125fe8bb97f6429797dd4b656b9c462ee57ff0502406e","event_type":"disclosure_policy_bound","prev_hash":"fe4f6a22bfed13359ea12a0c5eb3a2951d4632bf064b26c4e4e0181985dedc21","seq":4751},{"created_at":"2026-08-19T20:32:28.853896Z","event_hash":"c679baf2801c5412278cf07978759ebd2209b75f21961d6fcf0afc67fddb5e6f","event_type":"proof_verified","prev_hash":"ea08398ebe27863eaf5125fe8bb97f6429797dd4b656b9c462ee57ff0502406e","seq":4752},{"created_at":"2026-08-19T20:32:28.860873Z","event_hash":"12446c1f29dc486ab0266b788de0392bc77ff74aa14a96ce1128009affc98900","event_type":"wealth_suitability_assessed","prev_hash":"c679baf2801c5412278cf07978759ebd2209b75f21961d6fcf0afc67fddb5e6f","seq":4753},{"created_at":"2026-08-19T20:32:28.881081Z","event_hash":"bdcb17f7b7ffc388c34d9308e5cf032ec0a779006badae4700fb0eafb2c15128","event_type":"decision_human_reviewed","prev_hash":"12446c1f29dc486ab0266b788de0392bc77ff74aa14a96ce1128009affc98900","seq":4754}],"binding_replay":{"events":[{"created_at":"2026-08-19T20:32:27.161863Z","event_hash":"_k9qIr_tEzWeoSoMXrOilR1GMr8GSybE5OAYGYXe3CE","event_type":"decision_model_attestation_bound","prev_hash":"Qb9A0U34CfI2QkTDN1neH7r3Hpa_-T4thnDFnS_I39Y","rebuilt_payload":{"attested_at":"2026-08-19T20:32:27.161863Z","binding":"decision_model_attestation_binding/v1","declaration":"model_identified","input_context_fingerprint":"cdcdcdcdcdcdcdcdcdcdcdcdcdcdcdcdcdcdcdcdcdcdcdcdcdcdcdcdcdcdcdcd","model_config_fingerprint":"abababababababababababababababababababababababababababababababab","model_environment":"production","model_name":"claude-opus-4","model_provider":"anthropic","model_system_prompt_or_policy_id":"policy/suitability/7","model_timestamp":null,"model_version":"20260514","no_ai_attestation":null,"org_id":"cf45c9bb-3968-4306-a3b6-377e2a5518f2","output_fingerprint":"efefefefefefefefefefefefefefefefefefefefefefefefefefefefefefefef","prompt_version":"suitability-v7","request_id":"03698737-9f9c-425c-b893-3a5c0bfadcce","unidentified_reason":null},"ref_id":"03698737-9f9c-425c-b893-3a5c0bfadcce","seq":4750},{"created_at":"2026-08-19T20:32:27.161863Z","event_hash":"6gg5jr4nhj6vUSX-i7l_ZCl5fdS2VrnEYu5X_wUCQG4","event_type":"disclosure_policy_bound","prev_hash":"_k9qIr_tEzWeoSoMXrOilR1GMr8GSybE5OAYGYXe3CE","rebuilt_payload":{"binding":"disclosure_policy_binding/v1","circuit_type":"wealth_suitability","created_at":"2026-08-19T20:32:27.161863Z","expires_at":"2026-08-19T20:47:26.731715Z","nonce_b64":"AN6wltGjqAq8XIf_FA12xYSyiONcZSLeXEEgsDYPUuQ","org_id":"cf45c9bb-3968-4306-a3b6-377e2a5518f2","policy":{"categories":["financial"],"duration_seconds":900,"max_payload_size":null,"predicates":[],"purpose_hash":[97,2,0,124,47,196,142,109,217,83,104,21,131,137,144,225,224,124,254,178,186,5,205,7,254,124,144,198,132,58,103,93],"session_type":"Custom"},"request_id":"03698737-9f9c-425c-b893-3a5c0bfadcce","user_id":"8fbb731c-78df-4081-8759-98bb9bc2d901"},"ref_id":"03698737-9f9c-425c-b893-3a5c0bfadcce","seq":4751}],"events_naming_another_decision":0,"note":"The audit_log rows that commit to this decision's model attestation and to the policy it was measured against, with the payload each one hashed rebuilt from the rows as they stand. Memtara's own verdict on them is NOT carried here: recompute it. event_hash = SHA256(framed(event_type) || framed(ref_id) || framed(prev_hash) || framed(payload)), where framed(x) is an 8-byte big-endian length followed by x, ref_id is the UUID's 16 raw bytes, prev_hash is the raw digest bytes, and payload is the canonical JSON of rebuilt_payload. See docs/VERIFY.md step 7d.","supplied":true,"unavailable_reason":null},"circuit":"wealth_suitability","model_attestation":{"model":{"config_fingerprint":{"state":"recorded","unpopulated_reason":null,"value":"abababababababababababababababababababababababababababababababab"},"environment":{"state":"recorded","unpopulated_reason":null,"value":"production"},"model_name":{"state":"recorded","unpopulated_reason":null,"value":"claude-opus-4"},"model_version":{"state":"recorded","unpopulated_reason":null,"value":"20260514"},"prompt_version":{"state":"recorded","unpopulated_reason":null,"value":"suitability-v7"},"provider":{"state":"recorded","unpopulated_reason":null,"value":"anthropic"},"system_prompt_or_policy_id":{"state":"recorded","unpopulated_reason":null,"value":"policy/suitability/7"},"timestamp":{"state":"unpopulated","unpopulated_reason":"the calling system identified a model but did not supply ai_participation.timestamp on POST /api/v1/issue-wealth-request","value":null}},"model_provenance":{"as_declared_at_open":{"declaration":"model_identified","identity":{"config_fingerprint":"abababababababababababababababababababababababababababababababab","environment":"production","model_name":"claude-opus-4","model_version":"20260514","prompt_version":"suitability-v7","provider":"anthropic","system_prompt_or_policy_id":"policy/suitability/7","timestamp":null},"no_ai_attestation":null,"unidentified_reason":null},"corrected":false,"correction_count":0,"corrections":[],"declared_at":{"state":"recorded","unpopulated_reason":null,"value":"2026-08-19T20:32:27.161863Z"},"statement":"The model block in this record is what this organisation asserts about the AI system that participated in this decision. The declaration it made when the assessment was opened is preserved here under as_declared_at_open and is never altered by anything, including a correction. Note when that declaration is made: at open, in the same transaction as the assessment, before the subject's device has produced a proof, before a verdict exists and before any human review \u2014 so it is a statement about a decision that has not happened yet. Compare declared_at with decision.timestamps.assessed_at. Corrections are append-only and numbered from 1; a gap in correction_no means a correction was removed from the database after it was filed, and each one is separately committed to the audit chain."},"note":"The model identity the sealed DecisionEvidence record serves, carried so it can be compared with the identity the hash chain committed to. `supplied: false` means the exporter could not obtain it and is NOT the assertion that no AI participated; that assertion is `supplied: true` with `model: null`.","supplied":true,"unavailable_reason":null},"nonce":"0x00deb096d1a3a80abc5c87ff140d76c584b288e35c6522de5c4120b0360f52e4","opened_at":"2026-08-19T20:32:27.161863Z","organisation":{"id":"cf45c9bb-3968-4306-a3b6-377e2a5518f2","name":"DIFC Wealth Partners 236296","type":"bank"},"outcome":{"assessed":true,"assessed_at":"2026-08-19T20:32:28.860054Z","note":"`bb verify` succeeding means the proof is well formed, not that the client passed. The verdict is the circuit's public output and is read explicitly.","read_from":"public input 11 of 12","suitable":false},"product":{"id":"30528657-dc6e-4aad-9586-877259bf8b7e","isin":"XS2500000018","name":"5-year USD capital-protected note (DIFC-distributed)","product_ref":"0x00378d5af8ed32697c80a9283e5d431bf8adcdea64e505f00af918097ca3af97"},"proof_token":{"claims":{"cbuae_clauses":["5(c)","5(d)","4(a)"],"circuit":"wealth_suitability","dfsa_rules":["COB 3.1"],"exp":1787171848,"iat":1787171548,"iss":"http://127.0.0.1:65154","jti":"73c66624-c2b3-4268-9ac7-59b25351ab47","predicate":"structured_product_suitable","product_isin":"XS2500000018","proof_hash":"b5ae5f9f84aa60aa39b002a254c14d2545455b3440afdbb5809cdbdb1db8594c","regulatory_audit_id":"0484c505-c1f9-4917-8268-41d5dadef720","sub":"8fbb731c-78df-4081-8759-98bb9bc2d901","suitable":false,"user_id":"8fbb731c-78df-4081-8759-98bb9bc2d901","verified":true},"header":{"alg":"EdDSA","kid":"1IG2tMH7J2wbJZnOf8LJzQitKf7LMvoAElsuDMVM54Y","typ":"JWT"},"signature_bytes":64,"supplied":true,"token":"eyJhbGciOiJFZERTQSIsInR5cCI6IkpXVCIsImtpZCI6IjFJRzJ0TUg3SjJ3Ykpabk9mOExKelFpdEtmN0xNdm9BRWxzdURNVk01NFkifQ.eyJpc3MiOiJodHRwOi8vMTI3LjAuMC4xOjY1MTU0Iiwic3ViIjoiOGZiYjczMWMtNzhkZi00MDgxLTg3NTktOThiYjliYzJkOTAxIiwidXNlcl9pZCI6IjhmYmI3MzFjLTc4ZGYtNDA4MS04NzU5LTk4YmI5YmMyZDkwMSIsInByZWRpY2F0ZSI6InN0cnVjdHVyZWRfcHJvZHVjdF9zdWl0YWJsZSIsInZlcmlmaWVkIjp0cnVlLCJjaXJjdWl0Ijoid2VhbHRoX3N1aXRhYmlsaXR5IiwicHJvb2ZfaGFzaCI6ImI1YWU1ZjlmODRhYTYwYWEzOWIwMDJhMjU0YzE0ZDI1NDU0NTViMzQ0MGFmZGJiNTgwOWNkYmRiMWRiODU5NGMiLCJyZWd1bGF0b3J5X2F1ZGl0X2lkIjoiMDQ4NGM1MDUtYzFmOS00OTE3LTgyNjgtNDFkNWRhZGVmNzIwIiwiY2J1YWVfY2xhdXNlcyI6WyI1KGMpIiwiNShkKSIsIjQoYSkiXSwicHJvZHVjdF9pc2luIjoiWFMyNTAwMDAwMDE4Iiwic3VpdGFibGUiOmZhbHNlLCJkZnNhX3J1bGVzIjpbIkNPQiAzLjEiXSwiaWF0IjoxNzg3MTcxNTQ4LCJleHAiOjE3ODcxNzE4NDgsImp0aSI6IjczYzY2NjI0LWMyYjMtNDI2OC05YWM3LTU5YjI1MzUxYWI0NyJ9.OOYWQx5qpzz4VMTZM3tSe5w4SwLu7DA27V0TcIYjrLvLZAzfEGn-ZD7Z5puVAuGdSyvRgMKis2w3SiIaiXpDDg","verified_by_this_exporter":false},"proofs":[{"accepted_by_bb_verify":true,"proof_bytes":14656,"proof_id":"e665cb99-1b0a-4c5c-951c-5bde6859396a","proof_sha256":"b5ae5f9f84aa60aa39b002a25